{
  "artifacts": [
    {
      "available": true,
      "checks": [
        {
          "detail": {
            "kind": "agent_trace"
          },
          "message": "Manifest artifact kind is unique within the run.",
          "name": "manifest_kind_unique",
          "severity": "info",
          "status": "pass"
        },
        {
          "detail": {},
          "message": "Artifact was read through the repository facade.",
          "name": "repository_read",
          "severity": "info",
          "status": "pass"
        },
        {
          "detail": {
            "schema_ref": "schemas/agent-trace-event.schema.json",
            "status": "valid"
          },
          "message": "Payload schema validation status is valid.",
          "name": "schema_validation",
          "severity": "info",
          "status": "pass"
        },
        {
          "detail": {
            "actual": "schemas/agent-trace-event.schema.json",
            "expected": "schemas/agent-trace-event.schema.json"
          },
          "message": "Manifest schema_ref matches frozen artifact-kind metadata.",
          "name": "schema_ref",
          "severity": "info",
          "status": "pass"
        },
        {
          "detail": {
            "actual": [
              "event_id",
              "candidate_id",
              "review_item_id",
              "lookup_id",
              "cache_key",
              "response_id"
            ],
            "expected": [
              "event_id",
              "candidate_id",
              "review_item_id",
              "lookup_id",
              "cache_key",
              "response_id"
            ]
          },
          "message": "Manifest join_keys match frozen artifact-kind metadata.",
          "name": "join_keys",
          "severity": "info",
          "status": "pass"
        },
        {
          "detail": {
            "actual": [],
            "expected": []
          },
          "message": "Manifest depends_on matches frozen artifact-kind metadata.",
          "name": "depends_on",
          "severity": "info",
          "status": "pass"
        }
      ],
      "depends_on": [],
      "format": "jsonl",
      "join_keys": [
        "event_id",
        "candidate_id",
        "review_item_id",
        "lookup_id",
        "cache_key",
        "response_id"
      ],
      "kind": "agent_trace",
      "metadata": {
        "bytes": 1700,
        "depends_on": [],
        "format": "jsonl",
        "generated_at": "2026-07-10T00:00:00+00:00",
        "input_hash": "sha256:v11-diagnostic-fixture-input",
        "join_keys": [
          "event_id",
          "candidate_id",
          "review_item_id",
          "lookup_id",
          "cache_key",
          "response_id"
        ],
        "kind": "agent_trace",
        "path": "agent-trace.jsonl",
        "producer_version": "spirosearch-v11-fixture",
        "record_count": 3,
        "run_id": "v11-diagnostic-run-001",
        "schema_ref": "schemas/agent-trace-event.schema.json",
        "schema_version": "v6.run_artifact.v1",
        "sha256": "487db37e183544a6929018e4f49b5ee3d9b527ccbc23c00b0793c1ecb644a350"
      },
      "panel": null,
      "panel_id": null,
      "path": "agent-trace.jsonl",
      "required": true,
      "schema_ref": "schemas/agent-trace-event.schema.json",
      "status": "valid",
      "unavailable": null
    },
    {
      "available": true,
      "checks": [
        {
          "detail": {
            "kind": "canonical_evidence"
          },
          "message": "Manifest artifact kind is unique within the run.",
          "name": "manifest_kind_unique",
          "severity": "info",
          "status": "pass"
        },
        {
          "detail": {},
          "message": "Artifact was read through the repository facade.",
          "name": "repository_read",
          "severity": "info",
          "status": "pass"
        },
        {
          "detail": {
            "schema_ref": "schemas/canonical-evidence.schema.json",
            "status": "valid"
          },
          "message": "Payload schema validation status is valid.",
          "name": "schema_validation",
          "severity": "info",
          "status": "pass"
        },
        {
          "detail": {
            "actual": "schemas/canonical-evidence.schema.json",
            "expected": "schemas/canonical-evidence.schema.json"
          },
          "message": "Manifest schema_ref matches frozen artifact-kind metadata.",
          "name": "schema_ref",
          "severity": "info",
          "status": "pass"
        },
        {
          "detail": {
            "actual": [
              "candidate_id",
              "material_id",
              "use_instance_id",
              "energy_evidence_id",
              "review_item_id"
            ],
            "expected": [
              "candidate_id",
              "material_id",
              "use_instance_id",
              "energy_evidence_id",
              "review_item_id"
            ]
          },
          "message": "Manifest join_keys match frozen artifact-kind metadata.",
          "name": "join_keys",
          "severity": "info",
          "status": "pass"
        },
        {
          "detail": {
            "actual": [
              "enrichment_results",
              "review_events"
            ],
            "expected": [
              "enrichment_results",
              "review_events"
            ]
          },
          "message": "Manifest depends_on matches frozen artifact-kind metadata.",
          "name": "depends_on",
          "severity": "info",
          "status": "pass"
        }
      ],
      "depends_on": [
        "enrichment_results",
        "review_events"
      ],
      "format": "json",
      "join_keys": [
        "candidate_id",
        "material_id",
        "use_instance_id",
        "energy_evidence_id",
        "review_item_id"
      ],
      "kind": "canonical_evidence",
      "metadata": {
        "bytes": 6831,
        "depends_on": [
          "enrichment_results",
          "review_events"
        ],
        "format": "json",
        "generated_at": "2026-07-10T00:00:00+00:00",
        "input_hash": "sha256:v11-diagnostic-fixture-input",
        "join_keys": [
          "candidate_id",
          "material_id",
          "use_instance_id",
          "energy_evidence_id",
          "review_item_id"
        ],
        "kind": "canonical_evidence",
        "path": "canonical-evidence.json",
        "producer_version": "spirosearch-v11-fixture",
        "record_count": null,
        "run_id": "v11-diagnostic-run-001",
        "schema_ref": "schemas/canonical-evidence.schema.json",
        "schema_version": "v6.run_artifact.v1",
        "sha256": "024e653fa08abf2c536dfe8b8fe0cb744c8a0869cb6a472783352d9658964ea7"
      },
      "panel": null,
      "panel_id": null,
      "path": "canonical-evidence.json",
      "required": true,
      "schema_ref": "schemas/canonical-evidence.schema.json",
      "status": "valid",
      "unavailable": null
    },
    {
      "available": true,
      "checks": [
        {
          "detail": {
            "kind": "enrichment_results"
          },
          "message": "Manifest artifact kind is unique within the run.",
          "name": "manifest_kind_unique",
          "severity": "info",
          "status": "pass"
        },
        {
          "detail": {},
          "message": "Artifact was read through the repository facade.",
          "name": "repository_read",
          "severity": "info",
          "status": "pass"
        },
        {
          "detail": {
            "schema_ref": "schemas/enrichment-results.schema.json",
            "status": "valid"
          },
          "message": "Payload schema validation status is valid.",
          "name": "schema_validation",
          "severity": "info",
          "status": "pass"
        },
        {
          "detail": {
            "actual": "schemas/enrichment-results.schema.json",
            "expected": "schemas/enrichment-results.schema.json"
          },
          "message": "Manifest schema_ref matches frozen artifact-kind metadata.",
          "name": "schema_ref",
          "severity": "info",
          "status": "pass"
        },
        {
          "detail": {
            "actual": [
              "candidate_id",
              "review_item_id",
              "lookup_id",
              "cache_key",
              "response_id"
            ],
            "expected": [
              "candidate_id",
              "review_item_id",
              "lookup_id",
              "cache_key",
              "response_id"
            ]
          },
          "message": "Manifest join_keys match frozen artifact-kind metadata.",
          "name": "join_keys",
          "severity": "info",
          "status": "pass"
        },
        {
          "detail": {
            "actual": [
              "provider_cache_index"
            ],
            "expected": [
              "provider_cache_index"
            ]
          },
          "message": "Manifest depends_on matches frozen artifact-kind metadata.",
          "name": "depends_on",
          "severity": "info",
          "status": "pass"
        }
      ],
      "depends_on": [
        "provider_cache_index"
      ],
      "format": "json",
      "join_keys": [
        "candidate_id",
        "review_item_id",
        "lookup_id",
        "cache_key",
        "response_id"
      ],
      "kind": "enrichment_results",
      "metadata": {
        "bytes": 2678,
        "depends_on": [
          "provider_cache_index"
        ],
        "format": "json",
        "generated_at": "2026-07-10T00:00:00+00:00",
        "input_hash": "sha256:v11-diagnostic-fixture-input",
        "join_keys": [
          "candidate_id",
          "review_item_id",
          "lookup_id",
          "cache_key",
          "response_id"
        ],
        "kind": "enrichment_results",